{
  "schema_version": "1.0",
  "pack_id": "user-geo-field-batch-v1",
  "generated_at": "2026-03-18T08:00:00.000Z",
  "generator": {
    "model": "field-geotech-manual",
    "version": "1.0"
  },
  "source_report": {
    "report_id": "user-report:stope-14e-shift-b",
    "title": "Stope 14E Shift B Ground Conditions",
    "project": "North Decline Extension",
    "discipline": "geotechnical",
    "author": "Site Geotech Engineer",
    "organization": "Underground Operations",
    "date": "2026-03-18",
    "file_name": "stope_14e_shift_b_notes.json",
    "notes": "Shift-level observations captured during post-blast inspection."
  },
  "statistics": {
    "words": 0,
    "phrases": 0,
    "sentences": 0,
    "geo_materials": 4,
    "geo_features": 4,
    "strategies": 3,
    "images": 0
  },
  "items": {
    "words": [],
    "phrases": [],
    "sentences": [],
    "geo_materials": [
      {
        "id": "user-geo-material:slick-clay-seam",
        "canonical_name": "slick clay seam",
        "geo_material_category": "infill_material",
        "geo_material_subtype": "clay_infill",
        "description": "Thin slick clay seam on the hangingwall contact.",
        "identification_method": "Finger smear test and low cohesion on scraping.",
        "engineering_significance": "Can reduce shear resistance where blocks are daylighting.",
        "common_risks": "Slip along clay-coated surfaces.",
        "common_treatments": "Scale loose edges and bolt across seam where practical.",
        "source_ref": {
          "section": "Face Mapping",
          "sentence": "A slick clay seam was mapped on the hangingwall contact."
        }
      },
      {
        "id": "user-geo-material:oxidized-fracture-infill",
        "canonical_name": "oxidized fracture infill",
        "geo_material_category": "infill_material",
        "geo_material_subtype": "iron_oxide_infill",
        "description": "Rusty friable infill in persistent fractures near brow.",
        "identification_method": "Orange-brown powdery coating and staining.",
        "engineering_significance": "Indicative of water pathways and weakened fracture surfaces.",
        "common_risks": "Surface ravel from weathered infill zones.",
        "source_ref": {
          "section": "Brow Inspection",
          "sentence": "Oxidized fracture infill was present in the upper left brow."
        }
      },
      {
        "id": "user-geo-material:residual-volcanic-soil",
        "canonical_name": "residual volcanic soil",
        "geo_material_category": "soil",
        "geo_material_subtype": "residual_soil",
        "description": "Soft residual volcanic soil lens at the excavation edge.",
        "identification_method": "Hand-dug sample showed relict fabric and high moisture.",
        "engineering_significance": "Lower stand-up time compared with adjacent intact rock.",
        "common_risks": "Local unraveling and sloughing after blasting vibration.",
        "source_ref": {
          "section": "Wall Condition",
          "sentence": "Residual volcanic soil lens was logged on the east wall."
        }
      },
      {
        "id": "user-geo-material:decomposed-andesite",
        "canonical_name": "decomposed andesite",
        "geo_material_category": "rock",
        "geo_material_subtype": "highly_weathered_rock",
        "description": "Highly weathered andesite with low point-load response.",
        "identification_method": "Breaks down rapidly under light hammer impact.",
        "engineering_significance": "Requires shorter inspection intervals in production headings.",
        "common_risks": "Ravelling and progressive loosening around blast perimeter.",
        "source_ref": {
          "section": "Geology",
          "sentence": "Decomposed andesite was encountered in the blast-damaged brow."
        }
      }
    ],
    "geo_features": [
      {
        "id": "user-geo-feature:active-ravelling-pocket",
        "canonical_name": "active ravelling pocket",
        "geo_feature_category": "instability_feature",
        "geo_feature_subtype": "ravelling",
        "description": "Local ravelling pocket dropping chips from fractured brow.",
        "risk_implications": "Escalating loose rock hazard for entry crews.",
        "treatment_or_mitigation": "Targeted hand scaling prior to reinstating access.",
        "reporting_expressions": [
          "Active ravelling pocket noted above the brow line."
        ],
        "inspection_points": "Check for fresh fragments and aperture growth every round.",
        "source_ref": {
          "section": "Brow Inspection",
          "sentence": "Active ravelling pocket requires targeted hand scaling."
        }
      },
      {
        "id": "user-geo-feature:wet-open-joint",
        "canonical_name": "wet open joint",
        "geo_feature_category": "discontinuity_condition",
        "geo_feature_subtype": "open_joint",
        "description": "Open joint with intermittent seepage on sidewall.",
        "risk_implications": "Potential loss of block interlock and reduced friction.",
        "treatment_or_mitigation": "Install marker and short-interval re-inspection.",
        "reporting_expressions": [
          "Wet open joint observed on east wall."
        ],
        "inspection_points": "Track aperture change and moisture persistence per shift.",
        "source_ref": {
          "section": "Wall Condition",
          "sentence": "Wet open joint to be tracked with short-interval re-inspection."
        }
      },
      {
        "id": "user-geo-feature:blast-damaged-brow",
        "canonical_name": "blast damaged brow",
        "geo_feature_category": "blasting_feature",
        "geo_feature_subtype": "blast_damage",
        "description": "Over-fractured brow edge from recent blast perimeter.",
        "risk_implications": "Higher probability of detached chips during scaling.",
        "treatment_or_mitigation": "Detailed face mapping before further charging.",
        "reporting_expressions": [
          "Blast damaged brow present after round 214."
        ],
        "source_ref": {
          "section": "Post-Blast Review",
          "sentence": "Blast damaged brow to be captured in detailed face mapping."
        }
      },
      {
        "id": "user-geo-feature:foliation-daylighting-plane",
        "canonical_name": "foliation daylighting plane",
        "geo_feature_category": "structural_feature",
        "geo_feature_subtype": "foliation",
        "description": "Persistent foliation plane daylighting into excavation.",
        "risk_implications": "Can form sliding surfaces when combined with weak infill.",
        "inspection_points": "Measure dip persistence against excavation orientation.",
        "source_ref": {
          "section": "Structural Mapping",
          "sentence": "A foliation daylighting plane was traced across the crown."
        }
      }
    ],
    "strategies": [
      {
        "id": "user-strategy:targeted-hand-scaling",
        "canonical_name": "targeted hand scaling",
        "strategy_category": "temporary_control",
        "description": "Focused removal of loosened chips at the ravelling pocket.",
        "steps_or_method": "Scale from a protected position and clear debris before access.",
        "application_conditions": "Use when ravelling is active and localized.",
        "source_ref": {
          "section": "Controls",
          "sentence": "Targeted hand scaling required before the area is reopened."
        }
      },
      {
        "id": "user-strategy:short-interval-reinspection",
        "canonical_name": "short-interval re-inspection",
        "strategy_category": "monitoring_requirement",
        "description": "Shift-by-shift re-inspection of wet joints and brow condition.",
        "steps_or_method": "Record change in aperture, moisture, and loose fragments every shift.",
        "application_conditions": "Use where active seepage or evolving cracks are present.",
        "source_ref": {
          "section": "Monitoring",
          "sentence": "Short-interval re-inspection scheduled for the wet open joint."
        }
      },
      {
        "id": "user-strategy:detailed-face-mapping",
        "canonical_name": "detailed face mapping",
        "strategy_category": "inspection_method",
        "description": "High-resolution mapping of blast-damaged and structurally controlled zones.",
        "steps_or_method": "Capture trace geometry, condition notes, and hazard annotations.",
        "application_conditions": "Use after abnormal blast damage or newly exposed structures.",
        "source_ref": {
          "section": "Post-Blast Review",
          "sentence": "Detailed face mapping requested for blast-damaged brow sectors."
        }
      }
    ]
  },
  "images": []
}
